{
  "id": "template-protection-transformer-differential-87t",
  "type": "template",
  "category": "Protection Coordination",
  "subcategory": "Transformer Protection",
  "name": "Transformer Biased Differential Protection Template (87T)",
  "manufacturer": "AhmedETAP Protection Library",
  "model_number": "TPL-XFMR-DIFF-87T",
  "specs": {
    "basic_pickup_pu": 0.2,
    "slope_1_percent": 25.0,
    "slope_2_percent": 60.0,
    "breakpoint_1_pu": 1.25,
    "harmonic_restraint_2nd_percent": 15.0,
    "harmonic_restraint_5th_percent": 35.0,
    "unrestrained_instantaneous_pickup_pu": 8.0
  },
  "standards": [
    "IEEE C37.91",
    "IEC 60255"
  ],
  "tags": [
    "transformer-protection",
    "differential",
    "87t",
    "harmonic-restraint"
  ],
  "is_verified": true,
  "source": "ieee-standard",
  "contributor": "AhmedETAP Standards Committee",
  "created_at": "2026-01-01T00:00:00Z",
  "updated_at": "2026-01-01T00:00:00Z"
}