{
  "id": "cb-iec62271-mv-vcb-12kv-1250a-25ka",
  "type": "breaker",
  "category": "IEC 62271",
  "subcategory": "Vacuum Circuit Breaker",
  "name": "12kV Vacuum Circuit Breaker 1250A 25kA",
  "manufacturer": "Standard IEC Class",
  "model_number": "VCB-12-1250-25",
  "specs": {
    "rated_voltage_kv": 12.0,
    "rated_current_a": 1250,
    "breaking_capacity_ka": 25.0,
    "making_capacity_ka": 62.5,
    "short_time_withstand_ka_3s": 25.0,
    "operating_sequence": "O-0.3s-CO-3min-CO",
    "medium": "Vacuum"
  },
  "standards": [
    "IEC 62271-100",
    "IEC 62271-1"
  ],
  "tags": [
    "vcb",
    "medium-voltage",
    "vacuum",
    "12kv",
    "25ka"
  ],
  "is_verified": true,
  "source": "iec-standard",
  "contributor": "AhmedETAP Standards Committee",
  "created_at": "2026-01-01T00:00:00Z",
  "updated_at": "2026-01-01T00:00:00Z"
}