{
  "id": "cable-iec60364-al-pvc-1kv-1c-50",
  "type": "cable",
  "category": "IEC 60364",
  "subcategory": "AL/PVC 1kV",
  "name": "1kV Single Core PVC Aluminum Cable 50mm\u00b2",
  "manufacturer": "Generic Standard",
  "model_number": "IEC-AL-PVC-1X50",
  "specs": {
    "conductor_material": "aluminum",
    "insulation": "pvc",
    "voltage_rating_kv": 1.0,
    "cores": 1,
    "cross_section_mm2": 50,
    "resistance_ohm_per_km": 0.641,
    "reactance_ohm_per_km": 0.093,
    "current_rating_a": 150,
    "max_operating_temp_c": 70
  },
  "standards": [
    "IEC 60364-52",
    "IEC 60228"
  ],
  "tags": [
    "lv-cable",
    "aluminum",
    "pvc",
    "single-core",
    "50mm2"
  ],
  "is_verified": true,
  "source": "iec-standard",
  "contributor": "AhmedETAP Standards Committee",
  "created_at": "2026-01-01T00:00:00Z",
  "updated_at": "2026-01-01T00:00:00Z"
}